### ISSUE TITLE
Cannot access pypi.org from Kansas City

### ISSUE THREAD

**Issue by matshch** [pypi/support#8896]
### My Platform

The problem is reproducible from Nebius Cloud region us-central1, with `pip`, `curl`, and Google Chrome via SOCKS proxy. We have confirmed with Nebius Support that they are not blocking requests in any way.

### Fastly Debug

Note that latencies are skewed due to using SOCKS proxy via SSH connection to a host with this issue.
``` (paste your output on the next line)
ewogICJnZW9pcCI6IHsKICAgICJjaSI6ICJtaXNzb3VsYSIsCiAgICAic3QiOiAiTVQiLAogICAgImN0IjogInVuaXRlZCBzdGF0ZXMiLAogICAgImNvIjogIk5BIiwKICAgICJjX2lwIjogIjIwNC4xMi4xNjYuNjYiLAogICAgImNfYXNuIjogIjUzNDI4IiwKICAgICJjX2Fzbl9uYW1lIjogIm5lYml1cyBpbmMuIiwKICAgICJyX2lwIjogIjE3Mi42OS4xLjY3IiwKICAgICJyX2FzbiI6ICIxMzMzNSIsCiAgICAicl9hc25fbmFtZSI6ICJjbG91ZGZsYXJlIGluYy4iLAogICAgInJfY2kiOiAia2Fuc2FzIGNpdHkiLAogICAgInJfc3QiOiAiTU8iLAogICAgInJfY3QiOiAidW5pdGVkIHN0YXRlcyIsCiAgICAicl9jbyI6ICJOQSIKICB9LAogICJwb3BMYXRlbmN5IjogewogICAgImJvcyI6IDYwLAogICAgImNtaCI6IDM1LAogICAgImR0dyI6IDM2LAogICAgImdudiI6IDUwLAogICAgImhubCI6IDEwOCwKICAgICJpYWgiOiAzNSwKICAgICJrYXRsIjogNDgsCiAgICAia2JmaSI6IDcyLAogICAgImtidXIiOiAxMTAsCiAgICAia2NncyI6IDQ5LAogICAgImtkYWwiOiAyOCwKICAgICJrZGVuIjogMzAsCiAgICAia2RmdyI6IDI3LAogICAgImtld3IiOiA0NiwKICAgICJrZmxsIjogNjgsCiAgICAia2Z0eSI6IDQ2LAogICAgImtoaHIiOiA1OCwKICAgICJraWFkIjogNTMsCiAgICAia2lncSI6IDMwLAogICAgImtqeW8iOiA1MCwKICAgICJrbG90IjogMzIsCiAgICAia21pYSI6IDU4LAogICAgImtwYW8iOiAxMTEsCiAgICAia3BkayI6IDU0LAogICAgImtybnQiOiA2NiwKICAgICJrdGViIjogNDcsCiAgICAia3RraSI6IDI4LAogICAgImt3aHAiOiA1OSwKICAgICJsY2siOiA0MSwKICAgICJsZ2EiOiA0NiwKICAgICJtY2kiOiAxOSwKICAgICJtbXF0IjogNTIsCiAgICAibXNwIjogMzAsCiAgICAicGR4IjogMTIwLAogICAgInBoeCI6IDU0LAogICAgInNqYyI6IDIyMSwKICAgICJzdGwiOiA3OCwKICAgICJzdHAiOiAzMCwKICAgICJ5dWwiOiA4NywKICAgICJ5dnIiOiA2NSwKICAgICJ5eWMiOiA3MSwKICAgICJ5eXoiOiA0MywKICAgICJhbnkiOiAxNwogIH0sCiAgInBvcEFzc2lnbm1lbnRzIjogewogICAgImFjIjogIm1jaSIsCiAgICAiYXMiOiAibWNpIgogIH0sCiAgInJlcXVlc3QiOiB7CiAgICAicmVzb2x2ZXJfaXAiOiAiMTcyLjY5LjEuNjciLAogICAgInJlc29sdmVyX2FzX25hbWUiOiAiQ0xPVURGTEFSRU5FVCwgVVMiLAogICAgInJlc29sdmVyX2FzX251bWJlciI6ICIxMzMzNSIsCiAgICAicmVzb2x2ZXJfY291bnRyeV9jb2RlIjogIlVTIiwKICAgICJjbGllbnRfaXAiOiAiMjA0LjEyLjE2Ni42NiIsCiAgICAiY2xpZW50X2FzX25hbWUiOiAiS0NTLVVTLU5FQkksIFVTIiwKICAgICJjbGllbnRfYXNfbnVtYmVyIjogIjUzNDI4IiwKICAgICJ0aW1lIjogIjIwMjYtMDEtMTJUMTY6NDQ6NDIuMDAwWiIsCiAgICAiaG9zdCI6ICJ3d3cuZmFzdGx5LWRlYnVnLmNvbSIsCiAgICAiYWNjZXB0IjogInRleHQvaHRtbCxhcHBsaWNhdGlvbi94aHRtbCt4bWwsYXBwbGljYXRpb24veG1sO3E9MC45LGltYWdlL2F2aWYsaW1hZ2Uvd2VicCxpbWFnZS9hcG5nLCovKjtxPTAuOCxhcHBsaWNhdGlvbi9zaWduZWQtZXhjaGFuZ2U7dj1iMztxPTAuNyIsCiAgICAidXNlcmFnZW50IjogIk1vemlsbGEvNS4wIChNYWNpbnRvc2g7IEludGVsIE1hYyBPUyBYIDEwXzE1XzcpIEFwcGxlV2ViS2l0LzUzNy4zNiAoS0hUTUwsIGxpa2UgR2Vja28pIENocm9tZS8xNDMuMC4wLjAgU2FmYXJpLzUzNy4zNiIsCiAgICAiYWNjZXB0bGFuZ3VhZ2UiOiAiZW4tVVMsZW47cT0wLjkiLAogICAgImFjY2VwdGVuY29kaW5nIjogImd6aXAiLAogICAgImZhc3RseXNlcnZlcmlwIjogIjE1MS4xMDEuNjQuNjQiLAogICAgInhmZiI6ICIyMDQuMTIuMTY2LjY2IiwKICAgICJkYXRhY2VudGVyIjogIk1DSSIsCiAgICAiYmFuZHdpZHRoX21icHMiOiAiMTE0LjU1IiwKICAgICJjd25kIjogMTMwLAogICAgIm5leHRob3AiOiAiMTcyLjE4LjUyLjEiLAogICAgInJ0dCI6IDEuMjQyLAogICAgIm1pbl9ydHQiOiAwLjE1OSwKICAgICJkZWx0YV9yZXRyYW5zIjogMCwKICAgICJ0b3RhbF9yZXRyYW5zIjogMAogIH0KfQ==
```

### DNS Resolution

```console (paste your output after the line with the dig command)
$ dig pypi.org A

; <<>> DiG 9.20.17 <<>> pypi.org A
;; global options: +cmd
;; Got answer:
;; ->>HEADER<<- opcode: QUERY, status: NOERROR, id: 53009
;; flags: qr aa rd ra; QUERY: 1, ANSWER: 4, AUTHORITY: 0, ADDITIONAL: 1

;; OPT PSEUDOSECTION:
; EDNS: version: 0, flags:; udp: 1232
; COOKIE: 507c34650aa79fcd (echoed)
;; QUESTION SECTION:
;pypi.org.			IN	A

;; ANSWER SECTION:
pypi.org.		894	IN	A	151.101.192.223
pypi.org.		894	IN	A	151.101.0.223
pypi.org.		894	IN	A	151.101.128.223
pypi.org.		894	IN	A	151.101.64.223

;; Query time: 0 msec
;; SERVER: 10.96.0.10#53(10.96.0.10) (UDP)
;; WHEN: Mon Jan 12 16:47:02 UTC 2026
;; MSG SIZE  rcvd: 145

```

```console (paste your output after the line with the dig command)
$ dig pypi.org AAAA

; <<>> DiG 9.20.17 <<>> pypi.org AAAA
;; global options: +cmd
;; Got answer:
;; ->>HEADER<<- opcode: QUERY, status: NOERROR, id: 7548
;; flags: qr aa rd ra; QUERY: 1, ANSWER: 4, AUTHORITY: 0, ADDITIONAL: 1

;; OPT PSEUDOSECTION:
; EDNS: version: 0, flags:; udp: 1232
; COOKIE: bef6b534687e7a11 (echoed)
;; QUESTION SECTION:
;pypi.org.			IN	AAAA

;; ANSWER SECTION:
pypi.org.		806	IN	AAAA	2a04:4e42::223
pypi.org.		806	IN	AAAA	2a04:4e42:400::223
pypi.org.		806	IN	AAAA	2a04:4e42:200::223
pypi.org.		806	IN	AAAA	2a04:4e42:600::223

;; Query time: 0 msec
;; SERVER: 10.96.0.10#53(10.96.0.10) (UDP)
;; WHEN: Mon Jan 12 16:48:30 UTC 2026
;; MSG SIZE  rcvd: 193

```

```console (paste your output after the line with the dig command)
$ dig files.pythonhosted.org A

; <<>> DiG 9.20.17 <<>> files.pythonhosted.org A
;; global options: +cmd
;; Got answer:
;; ->>HEADER<<- opcode: QUERY, status: NOERROR, id: 6780
;; flags: qr aa rd ra; QUERY: 1, ANSWER: 5, AUTHORITY: 0, ADDITIONAL: 1

;; OPT PSEUDOSECTION:
; EDNS: version: 0, flags:; udp: 1232
; COOKIE: 70672cac36214322 (echoed)
;; QUESTION SECTION:
;files.pythonhosted.org.		IN	A

;; ANSWER SECTION:
files.pythonhosted.org.	85	IN	CNAME	dualstack.python.map.fastly.net.
dualstack.python.map.fastly.net. 85 IN	A	151.101.64.223
dualstack.python.map.fastly.net. 85 IN	A	151.101.192.223
dualstack.python.map.fastly.net. 85 IN	A	151.101.128.223
dualstack.python.map.fastly.net. 85 IN	A	151.101.0.223

;; Query time: 0 msec
;; SERVER: 10.96.0.10#53(10.96.0.10) (UDP)
;; WHEN: Mon Jan 12 16:48:41 UTC 2026
;; MSG SIZE  rcvd: 318

```

```console (paste your output after the line with the dig command)
$ dig files.pythonhosted.org AAAA

; <<>> DiG 9.20.17 <<>> files.pythonhosted.org AAAA
;; global options: +cmd
;; Got answer:
;; ->>HEADER<<- opcode: QUERY, status: NOERROR, id: 50527
;; flags: qr aa rd ra; QUERY: 1, ANSWER: 5, AUTHORITY: 0, ADDITIONAL: 1

;; OPT PSEUDOSECTION:
; EDNS: version: 0, flags:; udp: 1232
; COOKIE: 746bb16fc1ca3699 (echoed)
;; QUESTION SECTION:
;files.pythonhosted.org.		IN	AAAA

;; ANSWER SECTION:
files.pythonhosted.org.	140	IN	CNAME	dualstack.python.map.fastly.net.
dualstack.python.map.fastly.net. 140 IN	AAAA	2a04:4e42::223
dualstack.python.map.fastly.net. 140 IN	AAAA	2a04:4e42:200::223
dualstack.python.map.fastly.net. 140 IN	AAAA	2a04:4e42:600::223
dualstack.python.map.fastly.net. 140 IN	AAAA	2a04:4e42:400::223

;; Query time: 1 msec
;; SERVER: 10.96.0.10#53(10.96.0.10) (UDP)
;; WHEN: Mon Jan 12 16:48:48 UTC 2026
;; MSG SIZE  rcvd: 366

```

### Traceroutes / IPv4

```console (paste your output after the line with the traceroute command)
$ traceroute -4 pypi.org
traceroute to pypi.org (151.101.192.223), 30 hops max, 60 byte packets
 1  * * *
 2  10.205.28.173 (10.205.28.173)  0.048 ms  0.022 ms  0.021 ms
 3  204.12.166.1 (204.12.166.1)  0.120 ms  0.101 ms  0.061 ms
 4  * * *
 5  10.252.0.1 (10.252.0.1)  0.156 ms  0.149 ms *
 6  * * *
 7  38.104.87.53 (38.104.87.53)  0.800 ms nebius-inc.e0-79.core2.mci3.he.net (184.105.19.135)  0.628 ms 38.104.87.53 (38.104.87.53)  0.738 ms
 8  kanc-b2-link.ip.twelve99.net (62.115.183.56)  0.502 ms  0.468 ms  0.541 ms
 9  * * *
10  * * *
11  * * *
12  * * *
13  * * *
14  * * *
15  * * *
16  * * *
17  * * *
18  * * *
19  * * *
20  * * *
21  * * *
22  * * *
23  * * *
24  * * *
25  * * *
26  * * *
27  * * *
28  * * *
29  * * *
30  * * *
```

```console (paste your output after the line with the traceroute command)
$ traceroute -4 files.pythonhosted.org
traceroute to files.pythonhosted.org (151.101.128.223), 30 hops max, 60 byte packets
 1  * * *
 2  10.205.28.173 (10.205.28.173)  0.054 ms  0.030 ms  0.022 ms
 3  204.12.166.1 (204.12.166.1)  0.135 ms  0.118 ms  0.087 ms
 4  * * *
 5  * * *
 6  * * *
 7  38.104.87.53 (38.104.87.53)  0.681 ms nebius-inc.e0-79.core2.mci3.he.net (184.105.19.135)  0.659 ms 38.104.87.53 (38.104.87.53)  0.613 ms
 8  kanc-b2-link.ip.twelve99.net (62.115.198.68)  0.553 ms * kanc-b2-link.ip.twelve99.net (62.115.183.56)  1.503 ms
 9  * * *
10  * * *
11  * * *
12  * * *
13  * * *
14  * * *
15  * * *
16  * * *
17  * * *
18  * * *
19  * * *
20  * * *
21  * * *
22  * * *
23  * * *
24  * * *
25  * * *
26  * * *
27  * * *
28  * * *
29  * * *
30  * * *
```

### Traceroutes / IPv6 (If available)

```console (paste your output after the line with the traceroute command)
$ traceroute -6 pypi.org
traceroute to pypi.org (2a04:4e42::223), 30 hops max, 80 byte packets
 1  2607:e840:23:1:6e1e::53ae (2607:e840:23:1:6e1e::53ae)  0.028 ms  0.008 ms  0.009 ms
 2  2607:e840:23:1:6e1e::53ae (2607:e840:23:1:6e1e::53ae)  0.055 ms  0.021 ms  0.020 ms
 3  2607:e840:23:1::1 (2607:e840:23:1::1)  0.145 ms  0.132 ms  0.105 ms
 4  * * *
 5  * * *
 6  * * *
 7  2001:470:45d::2 (2001:470:45d::2)  0.636 ms  0.601 ms 2001:550:2:44::a3:2b (2001:550:2:44::a3:2b)  0.651 ms
 8  * kanc-b2-link.ip.twelve99.net (2001:2035:0:2798::1)  0.691 ms *
 9  * * *
10  * * *
11  * * *
12  * * *
13  * * *
14  * * *
15  * * *
16  * * *
17  * * *
18  * * *
19  * * *
20  * * *
21  * * *
22  * * *
23  * * *
24  * * *
25  * * *
26  * * *
27  * * *
28  * * *
29  * * *
30  * * *
```

```console (paste your output after the line with the traceroute command)
$ traceroute -6 files.pythonhosted.org
traceroute to files.pythonhosted.org (2a04:4e42:200::223), 30 hops max, 80 byte packets
 1  2607:e840:23:1:6e1e::53ae (2607:e840:23:1:6e1e::53ae)  0.036 ms  0.010 ms  0.008 ms
 2  2607:e840:23:1:6e1e::53ae (2607:e840:23:1:6e1e::53ae)  0.063 ms  0.022 ms  0.019 ms
 3  2607:e840:23:1::1 (2607:e840:23:1::1)  0.151 ms  0.135 ms  0.109 ms
 4  * * *
 5  * * *
 6  * * *
 7  2001:550:2:44::a3:2b (2001:550:2:44::a3:2b)  0.736 ms 2001:470:45d::2 (2001:470:45d::2)  0.798 ms  0.769 ms
 8  * kanc-b2-link.ip.twelve99.net (2001:2035:0:2798::1)  0.796 ms kanc-b2-link.ip.twelve99.net (2001:2035:0:2a0d::1)  0.675 ms
 9  * * *
10  * * *
11  * * *
12  * * *
13  * * *
14  * * *
15  * * *
16  * * *
17  * * *
18  * * *
19  * * *
20  * * *
21  * * *
22  * * *
23  * * *
24  * * *
25  * * *
26  * * *
27  * * *
28  * * *
29  * * *
30  * * *
```

### HTTPS Requests / IPv4

```console (paste your output after the line with the curl command)
$ curl -vvv -I --ipv4 https://pypi.org/pypi/pip/json
* Host pypi.org:443 was resolved.
* IPv6: (none)
* IPv4: 151.101.64.223, 151.101.0.223, 151.101.128.223, 151.101.192.223
*   Trying 151.101.64.223:443...
* connect to 151.101.64.223 port 443 from 10.205.28.171 port 57484 failed: Connection timed out
*   Trying 151.101.0.223:443...
* ipv4 connect timeout after 82084ms, move on!
*   Trying 151.101.128.223:443...
* ipv4 connect timeout after 41040ms, move on!
*   Trying 151.101.192.223:443...
* ipv4 connect timeout after 41038ms, move on!
* Failed to connect to pypi.org port 443 after 300004 ms: Timeout was reached
* Closing connection
curl: (28) Failed to connect to pypi.org port 443 after 300004 ms: Timeout was reached
```

```console (paste your output after the line with the curl command)
$ curl -vvv -I --ipv4 https://files.pythonhosted.org/packages/ae/e8/2340d46ecadb1692a1e455f13f75e596d4eab3d11a57446f08259dee8f02/pip-10.0.1.tar.gz
* Host files.pythonhosted.org:443 was resolved.
* IPv6: (none)
* IPv4: 151.101.0.223, 151.101.64.223, 151.101.192.223, 151.101.128.223
*   Trying 151.101.0.223:443...
* connect to 151.101.0.223 port 443 from 10.205.28.171 port 33442 failed: Connection timed out
*   Trying 151.101.64.223:443...
* ipv4 connect timeout after 82601ms, move on!
*   Trying 151.101.192.223:443...
* ipv4 connect timeout after 41300ms, move on!
*   Trying 151.101.128.223:443...
* ipv4 connect timeout after 41300ms, move on!
* Failed to connect to files.pythonhosted.org port 443 after 300741 ms: Timeout was reached
* Closing connection
curl: (28) Failed to connect to files.pythonhosted.org port 443 after 300741 ms: Timeout was reached
```

### HTTPS Requests / IPv6 (If available)

```console (paste your output after the line with the curl command)
$ curl -vvv -I --ipv6 https://pypi.org/pypi/pip/json
* Host pypi.org:443 was resolved.
* IPv6: 2a04:4e42:400::223, 2a04:4e42:200::223, 2a04:4e42::223, 2a04:4e42:600::223
* IPv4: (none)
*   Trying [2a04:4e42:400::223]:443...
* connect to 2a04:4e42:400::223 port 443 from 2607:e840:23:1:6e1e::b700 port 51392 failed: Connection timed out
*   Trying [2a04:4e42:200::223]:443...
* ipv6 connect timeout after 81796ms, move on!
*   Trying [2a04:4e42::223]:443...
* ipv6 connect timeout after 40897ms, move on!
*   Trying [2a04:4e42:600::223]:443...
* ipv6 connect timeout after 40895ms, move on!
* Failed to connect to pypi.org port 443 after 300145 ms: Timeout was reached
* Closing connection
curl: (28) Failed to connect to pypi.org port 443 after 300145 ms: Timeout was reached
```

```console (paste your output after the line with the curl command)
$ curl -vvv -I --ipv6 https://files.pythonhosted.org/packages/ae/e8/2340d46ecadb1692a1e455f13f75e596d4eab3d11a57446f08259dee8f02/pip-10.0.1.tar.gz
* Host files.pythonhosted.org:443 was resolved.
* IPv6: 2a04:4e42:600::223, 2a04:4e42:400::223, 2a04:4e42::223, 2a04:4e42:200::223
* IPv4: (none)
*   Trying [2a04:4e42:600::223]:443...
* connect to 2a04:4e42:600::223 port 443 from 2607:e840:23:1:6e1e::b700 port 55184 failed: Connection timed out
*   Trying [2a04:4e42:400::223]:443...
* ipv6 connect timeout after 83793ms, move on!
*   Trying [2a04:4e42::223]:443...
* ipv6 connect timeout after 41897ms, move on!
*   Trying [2a04:4e42:200::223]:443...
* ipv6 connect timeout after 41894ms, move on!
* Failed to connect to files.pythonhosted.org port 443 after 300150 ms: Timeout was reached
* Closing connection
curl: (28) Failed to connect to files.pythonhosted.org port 443 after 300150 ms: Timeout was reached
```

### TLS Debug / IPv4

```console (paste your output after the line with the openssl command)
$ echo -n | openssl s_client -4 -connect pypi.org:443
4007138E777F0000:error:8000006E:system library:BIO_connect:Connection timed out:../crypto/bio/bio_sock2.c:114:calling connect()
4007138E777F0000:error:10000067:BIO routines:BIO_connect:connect error:../crypto/bio/bio_sock2.c:116:
4007138E777F0000:error:8000006E:system library:BIO_connect:Connection timed out:../crypto/bio/bio_sock2.c:114:calling connect()
4007138E777F0000:error:10000067:BIO routines:BIO_connect:connect error:../crypto/bio/bio_sock2.c:116:
4007138E777F0000:error:8000006E:system library:BIO_connect:Connection timed out:../crypto/bio/bio_sock2.c:114:calling connect()
4007138E777F0000:error:10000067:BIO routines:BIO_connect:connect error:../crypto/bio/bio_sock2.c:116:
4007138E777F0000:error:8000006E:system library:BIO_connect:Connection timed out:../crypto/bio/bio_sock2.c:114:calling connect()
4007138E777F0000:error:10000067:BIO routines:BIO_connect:connect error:../crypto/bio/bio_sock2.c:116:
connect:errno=110
```

```console (paste your output after the line with the openssl command)
$ echo -n | openssl s_client -4 -connect files.pythonhosted.org:443
40070AA0547F0000:error:8000006E:system library:BIO_connect:Connection timed out:../crypto/bio/bio_sock2.c:114:calling connect()
40070AA0547F0000:error:10000067:BIO routines:BIO_connect:connect error:../crypto/bio/bio_sock2.c:116:
40070AA0547F0000:error:8000006E:system library:BIO_connect:Connection timed out:../crypto/bio/bio_sock2.c:114:calling connect()
40070AA0547F0000:error:10000067:BIO routines:BIO_connect:connect error:../crypto/bio/bio_sock2.c:116:
40070AA0547F0000:error:8000006E:system library:BIO_connect:Connection timed out:../crypto/bio/bio_sock2.c:114:calling connect()
40070AA0547F0000:error:10000067:BIO routines:BIO_connect:connect error:../crypto/bio/bio_sock2.c:116:
40070AA0547F0000:error:8000006E:system library:BIO_connect:Connection timed out:../crypto/bio/bio_sock2.c:114:calling connect()
40070AA0547F0000:error:10000067:BIO routines:BIO_connect:connect error:../crypto/bio/bio_sock2.c:116:
connect:errno=110
```

### TLS Debug / IPv6 (If available)

```console (paste your output after the line with the openssl command)
$ echo -n | openssl s_client -6 -connect pypi.org:443
40673882347F0000:error:8000006E:system library:BIO_connect:Connection timed out:../crypto/bio/bio_sock2.c:114:calling connect()
40673882347F0000:error:10000067:BIO routines:BIO_connect:connect error:../crypto/bio/bio_sock2.c:116:
40673882347F0000:error:8000006E:system library:BIO_connect:Connection timed out:../crypto/bio/bio_sock2.c:114:calling connect()
40673882347F0000:error:10000067:BIO routines:BIO_connect:connect error:../crypto/bio/bio_sock2.c:116:
40673882347F0000:error:8000006E:system library:BIO_connect:Connection timed out:../crypto/bio/bio_sock2.c:114:calling connect()
40673882347F0000:error:10000067:BIO routines:BIO_connect:connect error:../crypto/bio/bio_sock2.c:116:
40673882347F0000:error:8000006E:system library:BIO_connect:Connection timed out:../crypto/bio/bio_sock2.c:114:calling connect()
40673882347F0000:error:10000067:BIO routines:BIO_connect:connect error:../crypto/bio/bio_sock2.c:116:
connect:errno=110
```

```console (paste your output after the line with the openssl command)
$ echo -n | openssl s_client -6 -connect files.pythonhosted.org:443
408761F2E27F0000:error:8000006E:system library:BIO_connect:Connection timed out:../crypto/bio/bio_sock2.c:114:calling connect()
408761F2E27F0000:error:10000067:BIO routines:BIO_connect:connect error:../crypto/bio/bio_sock2.c:116:
408761F2E27F0000:error:8000006E:system library:BIO_connect:Connection timed out:../crypto/bio/bio_sock2.c:114:calling connect()
408761F2E27F0000:error:10000067:BIO routines:BIO_connect:connect error:../crypto/bio/bio_sock2.c:116:
408761F2E27F0000:error:8000006E:system library:BIO_connect:Connection timed out:../crypto/bio/bio_sock2.c:114:calling connect()
408761F2E27F0000:error:10000067:BIO routines:BIO_connect:connect error:../crypto/bio/bio_sock2.c:116:
408761F2E27F0000:error:8000006E:system library:BIO_connect:Connection timed out:../crypto/bio/bio_sock2.c:114:calling connect()
408761F2E27F0000:error:10000067:BIO routines:BIO_connect:connect error:../crypto/bio/bio_sock2.c:116:
connect:errno=110
```

### Code of Conduct

- [x] I agree to follow the PSF Code of Conduct

**Comment by matshch** [comment]
We see that this issue is reproducible from other probes in Kansas City:  https://bhxiesudwwicnijrrianynyjofmebnto.share1.thousandeyes.com/

**Comment by matshch** [comment]
An interesting observation from Nebius NOC is that if TTL matches the path exactly — we get TCP acknowledgements.

with default ttl 64 - no answer:
```
16:38:53.028512 00:16:3e:16:ba:a5 > b0:cf:0e:bc:fa:f0, ethertype IPv4 (0x0800), length 74: (tos 0x0, ttl 64, id 57427, offset 0, flags [DF], proto TCP (6), length 60)
    204.12.160.83.10002 > 151.101.0.223.443: Flags [S], cksum 0x04d3 (incorrect -> 0x4573), seq 2363042316, win 65535, options [mss 8960,sackOK,TS val 450815498 ecr 0,nop,wscale 8], length 0
16:38:55.018864 00:16:3e:16:ba:a5 > b0:cf:0e:bc:fa:f0, ethertype IPv4 (0x0800), length 74: (tos 0x0, ttl 64, id 56516, offset 0, flags [DF], proto TCP (6), length 60)
    204.12.160.83.10003 > 151.101.0.223.443: Flags [S], cksum 0x04d3 (incorrect -> 0x5fb9), seq 3242382229, win 65535, options [mss 8960,sackOK,TS val 450817488 ecr 0,nop,wscale 8], length 0
```

ttl 6 (exact number of hops to pypi) - syn+ack received:
```
16:38:10.352313 00:16:3e:16:ba:a5 > b0:cf:0e:bc:fa:f0, ethertype IPv4 (0x0800), length 74: (tos 0x0, ttl 6, id 28201, offset 0, flags [DF], proto TCP (6), length 60)
    204.12.160.83.57510 > 151.101.0.223.443: Flags [S], cksum 0x04d3 (incorrect -> 0x3de8), seq 553552531, win 65535, options [mss 8960,sackOK,TS val 450772821 ecr 0,nop,wscale 8], length 0
16:38:10.352511 b0:cf:0e:bc:fa:f0 > 00:16:3e:16:ba:a5, ethertype IPv4 (0x0800), length 74: (tos 0x0, ttl 59, id 0, offset 0, flags [DF], proto TCP (6), length 60)
    151.101.0.223.443 > 204.12.160.83.57510: Flags [S.], cksum 0x0e4b (correct), seq 2975789040, ack 553552532, win 65535, options [mss 1460,sackOK,TS val 2763917001 ecr 450772821,nop,wscale 9], length 0
```

**Comment by nicjohnson145** [comment]
Seconded. This is affecting my non-datacenter home IP as well.

**Comment by matshch** [comment]
It looks like this issue is resolved now, but there are still no issues recorded both on Python and Fastly status pages, so we aren't sure what happened.
